{
  "id": "meeting-2026-01-08-fiscal",
  "body_id": "larue-fiscal-court",
  "started_at": "2026-01-08T18:00:00Z",
  "ended_at": "2026-01-08T19:30:00Z",
  "artifact_ids": ["demo-001"],
  "motions": [
    {
      "id": "motion-001",
      "meeting_id": "meeting-2026-01-08-fiscal",
      "title": "Adopt January minutes",
      "description": "Approve the minutes from the January 2026 fiscal court meeting.",
      "result": "passed",
      "votes": [
        {
          "motion_id": "motion-001",
          "official_id": "official-amy-jones",
          "value": "yes"
        },
        {
          "motion_id": "motion-001",
          "official_id": "official-brian-lee",
          "value": "yes"
        }
      ]
    },
    {
      "id": "motion-002",
      "meeting_id": "meeting-2026-01-08-fiscal",
      "title": "Approve road repair contract",
      "description": "Authorize the county road repair contract with Acme Paving.",
      "result": "failed",
      "votes": [
        {
          "motion_id": "motion-002",
          "official_id": "official-amy-jones",
          "value": "no"
        },
        {
          "motion_id": "motion-002",
          "official_id": "official-brian-lee",
          "value": "no"
        }
      ]
    }
  ]
}
